{
  "$schema": "../../../render/script.schema.json",
  "width": 1920, "height": 1080, "fps": 30,
  "background": "transparent",
  "cat": { "x": 0.78, "y": 0.97, "scale": 0.8 },
  "lipsync": "../narration/narration-full.mp3",
  "timeline": [
    { "at": 0.0,   "do": "enter" },
    { "at": 0.8,   "do": "wave",  "scene": "bubble", "text": "我是知识猫" },
    { "at": 3.25,  "do": "curious", "scene": null },
    { "at": 12.1,  "do": "talk" },
    { "at": 15.75, "do": "jump" },
    { "at": 17.9,  "do": "talk" },
    { "at": 21.4,  "do": "talk", "cat": { "x": 0.86, "y": 0.97, "scale": 0.52, "duration": 0.9 } },
    { "at": 24.1,  "do": "surprised" },
    { "at": 25.3,  "do": "talk" },
    { "at": 30.0,  "do": "nod" },
    { "at": 37.2,  "do": "talk", "scene": "peek", "accessories": ["glasses"], "cat": { "x": 0.91, "y": 1.0, "scale": 0.44, "duration": 0.9 } },
    { "at": 45.6,  "do": "shake" },
    { "at": 47.4,  "do": "talk" },
    { "at": 56.7,  "do": "look" },
    { "at": 62.2,  "do": "think" },
    { "at": 70.2,  "do": "talk" },
    { "at": 74.9,  "do": "surprised" },
    { "at": 76.1,  "do": "talk" },
    { "at": 92.0,  "do": "look" },
    { "at": 102.7, "do": "nod" },
    { "at": 105.5, "do": "talk" },
    { "at": 109.9, "do": "scared", "scene": null, "cat": { "x": 0.66, "y": 0.97, "scale": 0.86, "duration": 1.0 } },
    { "at": 113.8, "do": "cheer" },
    { "at": 116.6, "do": "talk" },
    { "at": 119.4, "do": "talk", "scene": "peek", "cat": { "x": 0.93, "y": 1.0, "scale": 0.38, "duration": 0.9 } },
    { "at": 124.1, "do": "surprised" },
    { "at": 125.3, "do": "talk" },
    { "at": 132.9, "do": "happy" },
    { "at": 135.2, "do": "talk" },
    { "at": 138.2, "do": "curious" },
    { "at": 143.2, "do": "talk" },
    { "at": 153.1, "do": "nod" },
    { "at": 156.0, "do": "talk" },
    { "at": 161.2, "do": "talk", "scene": null, "accessories": ["glasses", "cap"], "cat": { "x": 0.87, "y": 0.97, "scale": 0.5, "duration": 0.9 } },
    { "at": 174.0, "do": "surprised" },
    { "at": 175.3, "do": "talk" },
    { "at": 197.8, "do": "talk", "scene": "sign", "text": "一行命令", "accessories": ["glasses"], "cat": { "x": 0.85, "y": 0.97, "scale": 0.56, "duration": 0.9 } },
    { "at": 205.2, "do": "talk", "scene": null },
    { "at": 214.5, "do": "nod" },
    { "at": 217.0, "do": "talk" },
    { "at": 219.2, "do": "talk", "accessories": [], "cat": { "x": 0.8, "y": 0.97, "scale": 0.7, "duration": 0.9 } },
    { "at": 221.1, "do": "shake" },
    { "at": 223.3, "do": "talk" },
    { "at": 235.0, "do": "happy" },
    { "at": 237.1, "do": "wave", "scene": "bubble", "text": "下期见！" },
    { "at": 240.2, "do": "exit" }
  ],
  "duration": 241.8
}
